{
  "base_revision": "AOS-000164",
  "created_at": "2026-08-24T06:25:25+08:00",
  "excluded_scope": [
    "real business data; mutation API; external side effects; release"
  ],
  "expected_outputs": [
    "Tenant-safe transaction exact-ref reader and five ready slice composition using existing Inventory reader"
  ],
  "lease_expires_at": "2026-08-24T12:00:00+08:00",
  "owner": "prime-sole-developer",
  "schema": "aos-memory-task-receipt/v1",
  "scope": [
    "services/aos-api/aos_api/ecommerce_operations_object_reader.py",
    "services/aos-api/tests/test_ecommerce_operations_object_reader.py",
    "services/aos-api/aos_api/ecommerce_workshop_operations.py",
    "services/aos-api/aos_api/ecommerce_workshop_operations_contracts.py",
    "services/aos-api/tests/test_ecommerce_workshop_operations_contracts.py",
    "services/aos-api/tests/test_ecommerce_workshop_operations_api.py"
  ],
  "status": "ACTIVE",
  "task_id": "w2-01b2-transaction-slices-code-20260824"
}
