{
  "base_revision": "AOS-000158",
  "created_at": "2026-08-24T04:29:54+08:00",
  "excluded_scope": [
    "real-business-data",
    "provider-side-effects",
    "migrations",
    "release"
  ],
  "expected_outputs": [
    "D0-exact-inventory-aftersales-authority-and-W2-binding"
  ],
  "lease_expires_at": "2026-08-24T12:30:00+08:00",
  "owner": "codex-aos-sole-developer",
  "schema": "aos-memory-task-receipt/v1",
  "scope": [
    "services/aos-api/aos_api/ecom_core_models.py",
    "services/aos-api/aos_api/ec_normalizer.py",
    "services/aos-api/aos_api/ecommerce_data_authority_contracts.py",
    "services/aos-api/aos_api/ecommerce_data_authority.py",
    "services/aos-api/aos_api/ecommerce_workshop_operations.py",
    "services/aos-api/tests/test_ecom_core_models.py",
    "services/aos-api/tests/test_ec_normalizer.py",
    "services/aos-api/tests/test_ecommerce_data_authority.py",
    "services/aos-api/tests/test_ecommerce_workshop_operations_api.py"
  ],
  "status": "ACTIVE",
  "task_id": "d0-inventory-aftersales-authority-code-20260824"
}
