{
  "base_revision": "AOS-000290",
  "created_at": "2026-08-26T12:06:56+08:00",
  "excluded_scope": [
    "plan/fulfill/reconcile execution reserved for later tasks; adapters; real database upgrade; real tenant data; external effects; release; unrelated dirty or untracked files"
  ],
  "expected_outputs": [
    "Principal-bound create/get/accept/reject/cancel and receipt-list canonical API, tenant spoof/unauthorized/idempotency/ETag negatives, generated aggregate consistency and safe delivery"
  ],
  "lease_expires_at": "2026-08-26T09:30:00+00:00",
  "owner": "codex-m1-serial",
  "schema": "aos-memory-task-receipt/v1",
  "scope": [
    "services/aos-api/aos_api/data_requirement_store.py",
    "services/aos-api/aos_api/routers/data_requirements.py",
    "services/aos-api/aos_api/routers/domain_manifest.json",
    "services/aos-api/aos_api/routers/domain_aggregates.py",
    "services/aos-api/tests/test_data_requirement_api.py",
    "docs/palantier/20_tech/电商平台接入/12-工作台层技术方案/119-BI-W0经营参谋生意探究全量开发清单与波次实施计划.md"
  ],
  "status": "ACTIVE",
  "task_id": "bi-w2-05-principal-scoped-canonical-api"
}
