{
  "base_revision": "AOS-000402",
  "created_at": "2026-08-28T22:48:38+08:00",
  "excluded_scope": [
    "current-plugin-installation",
    "current-database",
    "api-process-restart",
    "provider-network",
    "secret-resolution",
    "real-business-data",
    "migration",
    "release"
  ],
  "expected_outputs": [
    "Main lifespan consumes only the canonical startup factory result",
    "Inactive or failed-closed preflight creates no Provider Health loop",
    "GREEN startup uses the factory-built canonical maintainer without direct fallback construction",
    "Focused and cumulative regression evidence"
  ],
  "lease_expires_at": "2026-08-29T04:00:00+00:00",
  "owner": "aos-main-development",
  "schema": "aos-memory-task-receipt/v1",
  "scope": [
    "services/aos-api/aos_api/main.py",
    "services/aos-api/aos_api/aip_provider_health_maintenance.py",
    "services/aos-api/tests/aip/test_aip_provider_health_main_startup.py",
    ".evidence/workshop/2026-08-28-bi-w10-provider-health-main-startup-wiring/acceptance.md",
    "docs:palantier/20_tech/电商平台接入/12-工作台层技术方案/119-BI-W0经营参谋生意探究全量开发清单与波次实施计划.md#99"
  ],
  "status": "ACTIVE",
  "task_id": "BI-W10-02-PROVIDER-HEALTH-MAIN-STARTUP-WIRING"
}
