{
  "base_revision": "AOS-000330",
  "created_at": "2026-08-26T23:22:01+08:00",
  "excluded_scope": [
    "services/aos-api/alembic/versions",
    "real-business-data",
    "provider-execution"
  ],
  "expected_outputs": [
    "BI-W7-03-case-envelope-stage-rail-server-progress"
  ],
  "lease_expires_at": "2026-08-27T04:00:00+08:00",
  "owner": "codex-m1-single-serial",
  "schema": "aos-memory-task-receipt/v1",
  "scope": [
    "services/aos-api/aos_api/ecommerce_business_investigation_projection.py",
    "services/aos-api/tests/test_ecommerce_business_investigation_projection.py",
    "services/aos-api/tests/test_ecommerce_business_investigation_api.py",
    "apps/web/src/api/ecommerceInvestigation/contracts.ts",
    "apps/web/src/api/ecommerceInvestigation/parser.ts",
    "apps/web/src/api/ecommerceInvestigation/parser.test.ts",
    "apps/web/src/api/ecommerceInvestigation/client.ts",
    "apps/web/src/api/ecommerceInvestigation/client.test.ts",
    "apps/web/src/components/workshop/BusinessInvestigationTab.tsx",
    "apps/web/src/components/workshop/BusinessInvestigationTab.test.tsx",
    "apps/web/src/styles/45-ecommerce-workshop.css"
  ],
  "status": "ACTIVE",
  "task_id": "BI-W7-03"
}
