{
  "base_revision": "AOS-000401",
  "created_at": "2026-08-28T22:14:16+08:00",
  "excluded_scope": [
    "services/aos-api/aos_api/main.py",
    "current-plugin-installation",
    "current-database",
    "provider-network",
    "secret-resolution",
    "real-business-data",
    "migration",
    "release"
  ],
  "expected_outputs": [
    "Inactive-by-default startup result with no runtime construction or database read",
    "GREEN preflight composes the existing isolated canonical runtime only from explicit callables",
    "Construction performs zero Provider/readiness call and does not touch global registry",
    "Focused and cumulative regression evidence"
  ],
  "lease_expires_at": "2026-08-28T16:14:15+00:00",
  "owner": "aos-main-development",
  "schema": "aos-memory-task-receipt/v1",
  "scope": [
    "services/aos-api/aos_api/aip_provider_health_maintenance_startup.py",
    "services/aos-api/tests/aip/test_aip_provider_health_maintenance_startup.py",
    ".evidence/workshop/2026-08-28-bi-w10-provider-health-startup-runtime-factory/acceptance.md",
    "docs:palantier/20_tech/电商平台接入/12-工作台层技术方案/119-BI-W0经营参谋生意探究全量开发清单与波次实施计划.md#98"
  ],
  "status": "ACTIVE",
  "task_id": "BI-W10-02-PROVIDER-HEALTH-STARTUP-RUNTIME-FACTORY"
}
