{
  "base_revision": "AOS-000359",
  "created_at": "2026-08-27T14:04:12+08:00",
  "excluded_scope": [
    "org-org/dev-project-business-data",
    "real-provider-runtime"
  ],
  "expected_outputs": [
    "BI-W10-01-natural-snapshot-observation-repair",
    "BI-W10-01-repair-Delivery-Receipt"
  ],
  "lease_expires_at": "2026-08-27T18:00:00+08:00",
  "owner": "aos-main-development",
  "schema": "aos-memory-task-receipt/v1",
  "scope": [
    "services/aos-api/aos_api/ec_live_executor.py",
    "services/aos-api/aos_api/ec_normalizer.py",
    "services/aos-api/tests/test_ec_live_executor.py",
    "services/aos-api/tests/test_ec_normalizer.py",
    "docs/palantier/20_tech/电商平台接入/12-工作台层技术方案/119-BI-W0经营参谋生意探究全量开发清单与波次实施计划.md",
    "docs/palantier/AOS项目开发上下文/memory/receipts"
  ],
  "status": "ACTIVE",
  "task_id": "BI-W10-01-NATURAL-SNAPSHOT-OBSERVATION-REPAIR"
}
