{
  "base_revision": "AOS-000305",
  "created_at": "2026-08-26T17:15:49+08:00",
  "excluded_scope": [
    "artifact publication command,ArtifactRef cutoff/selection binding,HTTP APIs,AIP stage execution,real tenant data,external effects,migration apply,release"
  ],
  "expected_outputs": [
    "four governed L1 artifact revision contracts and empty authority schema without parallel Analyst truth"
  ],
  "lease_expires_at": "2026-08-26T13:00:00+00:00",
  "owner": "codex-m1-serial",
  "schema": "aos-memory-task-receipt/v1",
  "scope": [
    "services/aos-api/alembic/versions/biw4_004_investigation_artifact_revisions.py,services/aos-api/aos_api/ecommerce_business_investigation_artifact.py,services/aos-api/tests/test_ecommerce_business_investigation_artifact.py,docs:119-plan-and-memory-receipts"
  ],
  "status": "ACTIVE",
  "task_id": "bi-w4-04-governed-artifact-revision-refs"
}
