{
  "base_revision": "AOS-000325",
  "created_at": "2026-08-26T22:09:13+08:00",
  "excluded_scope": [
    "real business data; source reads; Provider invocation; external effects; shared migration apply; release"
  ],
  "expected_outputs": [
    "timeout to UNKNOWN to RECONCILING coordinator reusing canonical Run state authority; tests; Delivery Receipt; authority CAS; Prime readback"
  ],
  "lease_expires_at": "2026-08-27T04:00:00+00:00",
  "owner": "codex-m1",
  "schema": "aos-memory-task-receipt/v1",
  "scope": [
    "services/aos-api/aos_api/aip_business_investigation_reconcile_saga.py; services/aos-api/tests/test_aip_business_investigation_reconcile_saga.py; docs plan/receipts/authority projections"
  ],
  "status": "ACTIVE",
  "task_id": "BI-W6-05"
}
