{
  "base_revision": "AOS-000161",
  "created_at": "2026-08-24T04:53:49+08:00",
  "excluded_scope": [
    "real migration execution; real business data; API/SDK/Web; external side effects; release"
  ],
  "expected_outputs": [
    "Internal tenant-safe AggregationPolicy and OperationCase authority Store with expectedVersion/idempotency and fake-connection tests"
  ],
  "lease_expires_at": "2026-08-24T10:00:00+08:00",
  "owner": "prime-sole-developer",
  "schema": "aos-memory-task-receipt/v1",
  "scope": [
    "services/aos-api/aos_api/ecommerce_operation_case_store.py",
    "services/aos-api/tests/test_ecommerce_operation_case_store.py"
  ],
  "status": "ACTIVE",
  "task_id": "w3-12a2-operation-case-store-code-20260824"
}
