{
  "base_revision": "AOS-000370",
  "created_at": "2026-08-27T16:15:00+08:00",
  "excluded_scope": [
    "services/aos-api/aos_api",
    "apps/web",
    "real-business-data"
  ],
  "expected_outputs": [
    "Align P06 explicit source, JDBC runtime, object-first dangling Link and tenant directory fixtures"
  ],
  "lease_expires_at": "2026-08-27T10:14:59+00:00",
  "owner": "codex-m1-single-developer",
  "schema": "aos-memory-task-receipt/v1",
  "scope": [
    "services/aos-api/tests/test_ec_d1_p06_orderline.py",
    "services/aos-api/tests/test_ec_d1_p06_api_config.py",
    "docs/palantier/20_tech/电商平台接入/12-工作台层技术方案/119-BI-W0经营参谋生意探究全量开发清单与波次实施计划.md"
  ],
  "status": "ACTIVE",
  "task_id": "BI-W11-01-P06-ORDERLINE-FIXTURE-REPAIR"
}
